{"raw":"synthetic test question about Org Alpha","question_types":["profile"],"objective":"Profile Org Alpha (synthetic fixture)","audience":"test reader","constraints":[],"targets":["Org Alpha"],"stakes":"normal","attachments":[],"assumptions":[{"text":"synthetic fixture","stakes":"low"}],"vocab_allowlist":[]}
